{
  "$schema": "http://json-schema.org/draft-07/schema#",
  "title": "repair step answer",
  "description": "A red or clashing pull request, repaired on its own branch. Every fix carries its proof: a test the driver re-runs red-then-green, or \u2014 for a fix no test can pin, such as a lint or type error \u2014 the gate command the driver re-runs at the new head, and why no test can pin it.",
  "type": "object",
  "additionalProperties": false,
  "required": [
    "step",
    "skills",
    "status"
  ],
  "properties": {
    "step": {
      "const": "repair"
    },
    "skills": {
      "description": "Every Superpowers skill invoked in this step. The driver cross-checks this against the Skill calls in the run log, so a claim here the log does not show is a failed step.",
      "type": "array",
      "minItems": 1,
      "items": {
        "type": "string",
        "pattern": "^superpowers:[a-z][a-z-]*$"
      }
    },
    "status": {
      "enum": [
        "repaired",
        "unchanged",
        "park"
      ]
    },
    "cause": {
      "description": "What was actually wrong, in a line: the root cause, not the symptom the check printed.",
      "type": "string",
      "minLength": 1
    },
    "conflicts": {
      "description": "Each file that conflicted when the integration branch was merged in, and how both sides' intent was kept.",
      "type": "array",
      "items": {
        "type": "object",
        "additionalProperties": false,
        "required": [
          "file",
          "resolution"
        ],
        "properties": {
          "file": {
            "type": "string",
            "minLength": 1
          },
          "resolution": {
            "type": "string",
            "minLength": 1
          }
        }
      }
    },
    "takeBaseDeletions": {
      "description": "Each conflicted path the integration branch deleted whose deletion this merge takes. The driver checks each is deleted on the trunk side of this merge, runs the `git rm` itself and makes the merge commit; a path the trunk did not delete is refused.",
      "type": "array",
      "items": {
        "type": "string",
        "minLength": 1
      }
    },
    "fixes": {
      "type": "array",
      "items": {
        "type": "object",
        "additionalProperties": false,
        "required": [
          "what",
          "proof",
          "change",
          "command"
        ],
        "properties": {
          "what": {
            "type": "string",
            "minLength": 1
          },
          "proof": {
            "enum": [
              "test",
              "gate"
            ]
          },
          "change": {
            "type": "array",
            "items": {
              "type": "object",
              "additionalProperties": false,
              "required": [
                "path",
                "action"
              ],
              "properties": {
                "path": {
                  "type": "string",
                  "minLength": 1
                },
                "action": {
                  "enum": [
                    "create",
                    "modify",
                    "delete"
                  ]
                }
              }
            }
          },
          "command": {
            "description": "For a test proof, the command that runs the test. For a gate proof, the gate command that was red and is now green.",
            "type": "string",
            "minLength": 1
          },
          "test": {
            "type": "object",
            "additionalProperties": false,
            "required": [
              "file",
              "behaviour",
              "redWhen"
            ],
            "properties": {
              "file": {
                "type": "string",
                "minLength": 1
              },
              "behaviour": {
                "type": "string",
                "minLength": 1
              },
              "redWhen": {
                "description": "The production change that makes this test fail \u2014 the fix deleted, not a typo introduced. A test whose author cannot name one is measuring the shape of the code.",
                "type": "string",
                "minLength": 1
              }
            }
          },
          "failedBefore": {
            "const": true
          },
          "passedAfter": {
            "const": true
          },
          "testCommit": {
            "type": "string",
            "pattern": "^[0-9a-f]{7,40}$",
            "description": "The commit that added the test. The driver re-runs it at implCommit's parent and at implCommit."
          },
          "implCommit": {
            "type": "string",
            "pattern": "^[0-9a-f]{7,40}$",
            "description": "The commit that made it pass; never testCommit."
          },
          "noTestBecause": {
            "description": "For a gate proof only: why no test can pin this fix. A behaviour change always has a test.",
            "type": "string",
            "minLength": 1
          }
        },
        "if": {
          "properties": {
            "proof": {
              "const": "test"
            }
          }
        },
        "then": {
          "required": [
            "test",
            "testCommit",
            "implCommit",
            "failedBefore",
            "passedAfter"
          ]
        },
        "else": {
          "required": [
            "noTestBecause"
          ]
        }
      }
    },
    "question": {
      "description": "Why this step cannot finish. Answerable in a line: a yes/no or a pick.",
      "type": "string",
      "minLength": 1
    },
    "notes": {
      "type": "string"
    },
    "replacedTests": {
      "description": "Every test file in which this step removed, reworded or skipped an it()/test() case. `file` is the repo-relative path exactly as git shows it. Give exactly one of `coveredBy` \u2014 a bare repo-relative path, nothing else, to the test file at head that now pins the same behaviour (the same file, for a reworded case) \u2014 or `removedBecause`, one line on why the behaviour is gone. The ship step writes these into the pull request's `## Deleted tests` section, and the deleted-tests gate checks each line. Empty when no case was removed, reworded or skipped.",
      "type": "array",
      "items": {
        "type": "object",
        "additionalProperties": false,
        "required": [
          "file"
        ],
        "properties": {
          "file": {
            "type": "string"
          },
          "coveredBy": {
            "type": "string"
          },
          "removedBecause": {
            "type": "string"
          }
        }
      }
    },
    "reason": {
      "description": "For unchanged only: why the pull request needs no change \u2014 the brief is already met, and nothing is red or clashing.",
      "type": "string",
      "minLength": 1
    },
    "lesson": {
      "description": "Only when the lesson check is red: the `## Lesson` the driver writes into the pull request body. `guard` is one path to an executable test the diff adds or changes in substance: a test the PR already carries, or one this repair added and reports under `fixes` with proof test (red, then green). The driver re-runs the lesson check on the body before it writes it.",
      "type": "object",
      "additionalProperties": false,
      "required": [
        "principle",
        "guard",
        "beforeAfter",
        "reach"
      ],
      "properties": {
        "principle": {
          "description": "One sentence naming the class of mistake, not the instance.",
          "type": "string",
          "minLength": 1
        },
        "guard": {
          "description": "The repo-relative path of the test that guards it, bare (no backticks).",
          "type": "string",
          "minLength": 1
        },
        "beforeAfter": {
          "description": "How the guard fails on the pre-fix code and passes on the fix.",
          "type": "string",
          "minLength": 1
        },
        "reach": {
          "description": "The sibling the guard also catches, or the search that found none.",
          "type": "string",
          "minLength": 1
        }
      }
    }
  },
  "if": {
    "properties": {
      "status": {
        "const": "repaired"
      }
    }
  },
  "then": {
    "required": [
      "cause"
    ],
    "anyOf": [
      {
        "required": [
          "fixes"
        ],
        "properties": {
          "fixes": {
            "type": "array",
            "minItems": 1
          }
        }
      },
      {
        "required": [
          "lesson"
        ]
      }
    ]
  },
  "else": {
    "if": {
      "properties": {
        "status": {
          "const": "unchanged"
        }
      }
    },
    "then": {
      "required": [
        "reason"
      ]
    },
    "else": {
      "required": [
        "question"
      ]
    }
  }
}
