{
  "step": "repair",
  "skills": [
    "superpowers:systematic-debugging",
    "superpowers:test-driven-development"
  ],
  "status": "repaired",
  "cause": "the PR's reader change dropped the error branch",
  "fixes": [
    {
      "what": "the queue reader swallowed a fetch error, so the unit test job went red",
      "proof": "test",
      "change": [
        {
          "path": "src/queue/reader.ts",
          "action": "modify"
        }
      ],
      "test": {
        "file": "src/queue/reader.test.ts",
        "behaviour": "read() against a throwing fetch returns state 'failed'",
        "redWhen": "the catch block is deleted"
      },
      "command": "npm test -- src/queue/reader.test.ts",
      "failedBefore": true,
      "passedAfter": true,
      "testCommit": "a1b2c3d4",
      "implCommit": "e5f6a7b8"
    }
  ]
}
